{
  "version": 1,
  "gameId": "rome_123456",
  "turn": 42,
  "overview": { "civilization": "Rome" },
  "units": [
    { "id": 7, "name": "Warrior", "x": 10, "y": 8 },
    { "id": 8, "name": "Scout", "x": 12, "y": 9 }
  ],
  "cities": [
    { "id": 3, "name": "Rome", "x": 9, "y": 8 }
  ],
  "map": { "width": 100, "height": 60 },
  "diplomacy": [],
  "victory": {},
  "blockers": [],
  "recentEvents": []
}
